Company,Content,Operating Status,Description,Funding Status,Website,Last Funding Type,Company Type,Categories
CloudMedx Inc,FOUND,active,"CloudMedx was started with the aim to make healthcare affordable, accessible and standardized for all patients and doctors. The foundation of the company is based on a near death experience that one of the founder's father experienced as a result of a misdiagnosis. CloudMedx uses NLP and deep learning to extract key clinical concepts from the...
Read More",N/A,www.cloudmedxhealth.com,venture - series unknown,for profit,"artificial intelligence, big data, health care, information technology, machine learning, natural language processing, neuroscience, personal health, predictive analytics"
CoachAi,FOUND,active,"CoachAi uses artificial intelligence and behavioral psychology to create lasting behavioral change.
CoachAi drastically improves health clubs’ member engagement and retention. Using proven behavioral science, CoachAi helps members achieve their fitness goals and make exercise into a regular part of their lives.",N/A,www.coachai.com/,N/A,for profit,"artificial intelligence, psychology, wellness"
COCO-MAT,FOUND,active,"COCO-MAT today is a recognised leader for natural sleep products, bed linen, towels and furniture for homes and hotels.
When they founded COCO-MAT back in 1989, they shared a common dream; offer blissful sleep to every person who sleeps on their beds, their pillows and their mattresses.
Using Nature’s wisdom as a guide and source of...
Read More",N/A,www.coco-mat.com/us_en,N/A,for profit,"consumer goods, lifestyle, manufacturing"
Cogisen,FOUND,active,"Cogisen develops artificial intelligence solutions. It offers SENCOGI, an eye-tracking software for smartphones/mobile phones.
Chiara Passacantilli and Christiaan Erik Rijnders founded Cogisen in 2009. Its headquarters is in Naples in Italy.",early stage venture,www.cogisen.com/,grant,for profit,"artificial intelligence, computer vision, image recognition, internet of things, neuroscience"
Cogmed,FOUND,active,"Cogmed is the leader in evidence-based training solutions for improved cognitive performance
Cogmed creates, validates, and markets products for individuals of all age levels allowing them to unlock their natural cognitive abilities by training their brain.
They believe that carefully designed, scientifically tested, and professionally...
Read More",N/A,www.cogmed.com/,N/A,for profit,"education, fitness, health care, software"
Cognatory,FOUND,active,Cognatory is an educational technology (EdTech) company which is committed in improving the mental health and wealth of students using the latest advances in the science of learning.,N/A,N/A,N/A,for profit,"edtech, education, health care, knowledge management"
Cogniciti,FOUND,active,"We rely on our mental abilities to accomplish everything from creative problem solving to staying alert and focused. While central to our lives, little has been known about how the brain accomplishes its function. Recent advances in neuroscience, however, are revealing evidence of how the common concepts of memory, attention, motivation, and...
Read More",N/A,www.cogniciti.com,N/A,N/A,"biotechnology, health care, medical"
CogniFit,FOUND,active,"CogniFit is a revolutionary technology that lets you explore your brain, assess your cognitive abilities and train the skills that are important to you. You will instantly know how fit your brain is and what can be done to boost it.
The company uses patented, scientifically validated technology to develop and market software which enhances basic...
Read More",early stage venture,www.cognifit.com,series a,N/A,"artificial intelligence, education, fitness, health care, information technology, wellness"
Cognilab Technologies,FOUND,active,"Cognilab Technologies is an online laboratory for creating, crowdsourcing and sharing psychology experiments.
Cognilab is the world's first online laboratory for psychology research. Their service is 10x cheaper, faster and easier than using a physical lab for experiments.",seed,cognilab.com,seed,N/A,"psychology, universities"
Cognisess,FOUND,active,"Cognisess is the provider of people analytics software to business, via our enterprise talent platform. We leverage neuroscience, video profiling, game mechanics and data insight to transform a company’s understanding and performance of its most valuable asset – people.
Cognitive neuroscience is re-shaping our view of the brain and Cognisess...
Read More",N/A,www.cognisess.com,venture - series unknown,for profit,"analytics, artificial intelligence, b2b, human resources, neuroscience, psychology, recruiting, software"
Cognition Therapeutics,FOUND,active,"Cognition Therapeutics, Inc. is focused on the discovery and development of small molecule therapeutics targeting the toxic proteins that cause the cognitive decline associated with Alzheimer's disease and other degenerative diseases of the human brain. Toxic proteins play a crucial role in a large class of disease targets, and there are...
Read More",N/A,www.cogrx.com,grant,for profit,"biotechnology, life science, therapeutics"
Cognitive Algorithms Laboratory,FOUND,active,"CAL Labs investigates the foundations of human intelligence and functional capacity. It lays the groundwork for both weak and strong AI by incorporating both top-down and bottom-up approaches to the evolutionary mechanisms that led to behaviorally modern humans. Further research into the elements of cognition has immediate impact when using big...
Read More",N/A,N/A,N/A,for profit,"artificial intelligence, health care, neuroscience"
Cognitive Electronics,FOUND,active,"Cognitive Electronics was founded by Andrew Felch, Richard Granger, Mac Dougherty and Gregg Fairbrothers and was inspired by Andrew and Rick’s knowledge of human brain algorithms. This knowledge was put to use developing hardware that provides brain-like high performance and software programmability.",N/A,www.cognitive-electronics.com,venture - series unknown,N/A,"analytics, information services, information technology"
Cognixion,FOUND,active,"Cognixion™ is the revolutionary sensory communication system that enables people to communicate using a brain computer interface (BCI) that translates brainwaves directly into communication. Cognixion has been internationally recognized for its innovation and use of exponential technologies to solve a social and healthcare global challenge -...
Read More",seed,www.cognixion.com/,seed,for profit,"artificial intelligence, augmented reality, biotechnology, neuroscience, software"
Verge Genomics,FOUND,active,"Verge Genomics is looking to find cures for brain diseases. Alzheimers, ALS, and Parkinsons are complex diseases that usually involve a network of genes, as opposed to a single gene.",early stage venture,www.vergegenomics.com,series a,for profit,"genetics, health care"
Versus,NOT FOUND,N/A,N/A,N/A,N/A,N/A,N/A,N/A
Vic.ai,FOUND,active,"Vic.ai is a service that automates accounting and provides financial advice and support through the use of Artificial Intelligence (“A.I.”).
Research estimates a 94% chance that most of the accounting industry will be automated ($100bn Industry in the US).
Through more than 15 years experience in the Cloud Accounting space, and with access to...
Read More",seed,www.vic.ai,seed,for profit,"accounting, artificial intelligence, financial services, information services"
Virobay,FOUND,active,"Virobay, Inc. operates as an anti-viral drug discovery and development company. It engages in developing, investigating, and creating treatments for hepatitis C, such as protease and polymerase inhibitors. The company was founded in 2006 and is headquartered in Menlo Park, California.",ipo,www.virobayinc.com,series b,for profit,"biotechnology, neuroscience, pharmaceutical"
Virtuleap,FOUND,active,"We enable the body to speak in XR using neuroscience research and machine learning. Our biometric algorithms translate subliminal body language into psychographics, so that you can know whether your users are excited, angry, or bored of their minds in the context of any immersive content. We are currently developing an edutainment app called the...
Read More",seed,www.virtuleap.com,seed,for profit,"3d technology, apps, big data, biometrics, internet, machine learning, neuroscience, predictive analytics, saas, virtual reality"
Visible Insignia,FOUND,active,"Visible Insignia is an SEO company in Houston. Their SEO consultant in Houston was placed as the top 25 consultants in Houston. They offer internet marketing for psychologists, psychiatrists, and other mental health counselors in private practice. They also offer free website for counselors. They use SEO, PPC, Social media management, brand...
Read More",N/A,www.visibleinsignia.com,N/A,for profit,"advertising, consulting, marketing"
Visikol,FOUND,active,"Visikol is a CRO focused on advanced drug discovery that is leading the field of bio-imaging, bioinformatics and image analysis. We conduct end-to-end drug discovery services that include both 2D and 3D in vitro models and assays, 3D whole mount tissue imaging, digital pathology and custom drug discovery projects. Visikol offers a portfolio of drug...
Read More",early stage venture,visikol.com/,grant,for profit,"biotechnology, developer tools, information technology, neuroscience"
Vita Beans Neural Solutions,FOUND,active,"Vita Beans is a startup by graduates of BITS Pilani. A long time back, They started out as an intellectual endeavor to build an Artificial Intelligence agent (AI agent) that can make decisions just like the human brain does. i.e. not just by considering economic & tangible criteria involved in decision making, but also evolutionary, emotional...
Read More",N/A,vitabeans.com/,N/A,for profit,neuroscience
Vita Sound,FOUND,active,"itaSound Audio Inc is an audio-enhancement technology company which develops and brings to market advanced audio solutions that enhance the quality of life for the boomer generation. Utilizing leading-edge brain science, our patented Neuro-Compensator is a ‘best-in-class’ technology, which significantly improves the listening experience by...
Read More",N/A,www.vitasound.com,venture - series unknown,N/A,"audio, consumer electronics"
Vitalus Sleep,FOUND,active,"We provide expert, comfortable care that helps Houston sleep soundly. Our private rooms and amenities make you feel like you're at a luxury hotel. You can get a superior night's sleep...let Superior Sleep Center help you do it.",N/A,www.vitalussleep.com,N/A,for profit,"health care, lifestyle"
Vittude,FOUND,active,"Every dollar invested in scaling up treatment for those with depression and anxiety leads to a 4x return in better health and productivity. With Vittude, Brazilians can talk to their psychologists anytime, anywhere. Our psychologists can access marketing, technology and additional income.",N/A,www.vittude.com,convertible note,for profit,"health care, psychology, therapeutics"
VMake,FOUND,active,VMake Inc is a mobile apps developing company that develops apps for Android and iOS platforms. They have developed apps like FitnessFast - Daily fitness exercise workout weight & sleep tracker and Remindsy - Social Reminders.,N/A,www.vmakevisas.com,N/A,N/A,health care
Voicery,FOUND,active,"Voicery synthesizes the most realistic human voices using deep neural networks. Prior to starting Voicery, Andrew, one of the founders, led the speech synthesis research team at Baidu Research. By synthesizing speech nearly indistinguishable from human, Voicery aims to enable new media applications, such as auto-generated audiobooks, podcasts,...
Read More",early stage venture,www.voicery.com/,series a,N/A,"neuroscience, speech recognition"
Vycor Medical,FOUND,active,"Vycor Medical, Inc. is a medical device company committed to making neurological brain, spinal and other surgical procedures safer and more effective. Vycor's innovative medical instruments are designed to optimize neurosurgical site access, reduce patient risk, accelerate recovery, and add tangible value to the professional medical community.",ipo,vycormedical.com,post-ipo equity,N/A,"hardware, health care, medical device, software"
We Sell Sleep,FOUND,active,"We Sell Sleep want to give you a one-stop shop for both sleep advice and a place to find sleep related products that have been tried and tested. With a singular mission of helping you sleep better They hope to improve your sleep, and in turn improve your life.
They hope that you find something in Their extensive product range that will make a...
Read More",N/A,wesellsleep.com/,N/A,for profit,"e-commerce, health care"
Wealth Words,FOUND,active,"Make Real Money by Playing Online Games! Wealth Words, is an online gaming platform to play crossword puzzle games online. Train your brain to unleash your words search puzzle skills and earn real money by solving puzzle games. Play and win cash with Wealth Words.",N/A,www.wealthwords.com/,N/A,for profit,gaming
WeAreBrain,FOUND,active,"Founded in 2014, WeAreBrain is a full-service strategic technology agency in the business of ideas, entrepreneurship and invention. We are entrepreneurs at heart and enable clients to create and execute strategies and solutions for their digital transformation. We imagine, create and develop intelligent design, thoughtful products and solutions. We...
Read More",N/A,www.wearebrain.com/,N/A,for profit,"artificial intelligence, consulting, information technology, mobile, product design, software"
WeSee,FOUND,active,"Our mission at WeSee is to enable a safer society, by looking out for the good guys and helping catch the bad. WeSee pushes AI beyond facial recognition, detecting suspicious behaviour which we believe holds the key to our safety and security, at home and at work.
Pushing artificial intelligence beyond facial recognition, WeSee can analyse an...
Read More",N/A,www.wesee.com,N/A,for profit,"artificial intelligence, computer vision, content discovery, image recognition, insurance, insurtech, neuroscience, video"
West Bend Assisted Living Pharmacy,FOUND,active,"West Bend Assisted Living Pharmacy provide medication dispensing and pharmacy consulting services to a variety of facilities, including:
- Community Based Residential Facilites (CBRF)
- Residential Care Apartment Complexes (RCAC)
- Adult Family Homes (AFH)
- Hospice Care
- Adult Foster Care
- Select Outpatient Populations
- Correctional...
Read More",m&a,www.westbendnhrx.com/,N/A,for profit,"health care, pharmaceutical"
Widget Brain,FOUND,active,"Widget Brain is passionate about creating smart solutions that have a real impact on daily life: algorithms that lower CO2, improve recycling rates, deliver faster, prevent critical failures and decide autonomously.
We are ambitious in achieving our vision of the future. In that future, we see a connected universe of things, capable of...
Read More",N/A,www.widgetbrain.com,N/A,for profit,"artificial intelligence, information technology, internet, robotics"
WildBrain,FOUND,active,"WildBrain Family International (""WildBrain"") is an industry leader in online video management and the creation of preschool and children’s entertainment content on YouTube. We make and share videos on YouTube, running a network of channels, managing the rights and audience growth from our catalogue of over 11,500 half hours of video...
Read More",m&a,www.wildbrain.com,venture - series unknown,for profit,"advertising, gaming, internet"
Windward Way Recovery,FOUND,active,"Windward Way Recovery is a mental health care institution that offers five phases of clinical drug treatment; detox, inpatient, PHP (partial hospitalization), IOP (intensive outpatient), and aftercare. Its facilities locally support communities in Costa Mesa, Newport Beach, Irvine, Huntington Beach, Long Beach, & Laguna Beach, which are...
Read More",N/A,windwardway.com/,N/A,N/A,"health care, medical, personal health"
