Company,Content,Operating Status,Description,Funding Status,Website,Last Funding Type,Company Type,Categories
Savonix,FOUND,active,"Savonix provides a valid and reliable measurement of cognitive function mapped to real world outcomes in domains like cognitive flexibility and on road performance in aging populations. Their customers include doctors, researchers, Fortune 50 insurance, and governments. Their platform provides users with easy to use and accessible tests of their...
Read More",early stage venture,savonix.com/,series a,for profit,"apps, artificial intelligence, health care, information services, information technology, medical, mobile, skill assessment"
Scalable Systems Research Labs,FOUND,active,"Scalable Systems Research Labs, Inc. ('SSRLabs') develops and sells a family of massively parallel coprocessors with standard APIs to solve the ""Big Data"" and numerically intensive problems. These coprocessors work with a variety of standards-based application programming interfaces (APIs). SSRLabs' family of coprocessors...
Read More",seed,www.ssrlabs.com,seed,N/A,"big data, fintech, security"
Schlaf-Fass Ch,FOUND,active,"The beautiful wine region of the Grisons. They look forward to welcoming you soon as a guest in one of Their SCHLAF-FÄSSER (converted wine barrels). This will be an exclusive, unforgettable and most fascinating experience. You will stay in one of the converted 8000 litre wine barrels in your chosen location. With a lot of attention to detail, these...
Read More",N/A,schlaf-fass.ch/,N/A,for profit,wine and spirits
"Science, Language & Arts International School",FOUND,active,"Science, Language & Arts International School is an independent Nursery to Grade 8 school in Brooklyn, focused on hands-on science, arts, and math and committed to providing children with a rich and rigorous multilingual education. Our project-based approach is informed by brain development research and promotes collaborative learning and...
Read More",N/A,slaschool.org,N/A,non-profit,education
ScienceDaily,FOUND,active,"ScienceDaily is an online and mobile platform that provides its users with information related to all areas of science. It provides its insights and news related areas such as health and medicine, mind and brain, space and time, matter and energy, computers and mathematics, plants and animals, earth and climate, and much more.
It also...
Read More",N/A,www.sciencedaily.com/,N/A,for profit,news
Scientific Learning Corporation,FOUND,active,"They develop, market and sell products and services that are based on brain research and are designed to increase human learning and performance. To date, their primary focus has been on the language and reading skills that are the foundation for learning. They have developed, have field tested and are selling software to help children learn how to...
Read More",ipo,www.scilearn.com,N/A,N/A,language learning
SCM Neuroscience,FOUND,active,"SCM Neuroscience is a startup that offers advises in various areas of neuroscience, with a special focus on neuromarketing. The company’s eye-tracking technology consists of a system that detects ocular movement and a program that organizes studied subject data and converts them into statistics.
Additionally, it offers other services such as...
Read More",N/A,www.scmneuroscience.com,N/A,N/A,"health diagnostics, market research, neuroscience"
Seaside Therapeutics,FOUND,active,"Seaside Therapeutics was founded to translate promising research discoveries into effective treatments for patients with autism, fragile X syndrome and other disorders of brain development. Our vision is to successfully develop breakthrough medications that will meaningfully improve the lives of individuals with these disorders.",N/A,www.seasidetherapeutics.com,venture - series unknown,N/A,"biotechnology, medical device, therapeutics"
Seasons in Malibu,FOUND,active,"At Seasons in Malibu, they agree with the leading scientists and doctors of the National Institute for Drug Addiction that addiction is a completely treatable chronic disease. They believe it is best addressed not just at the individual level of behavior but systemically from the cellular systems to the systems of neurobiology of the brain and the...
Read More",N/A,seasonsmalibu.com,N/A,N/A,health care
Seekly,FOUND,closed,"Seekly provides a face to face, speed date Online. Using various filters users will be matched up to ""date"" in order to see if they would like to get to know someone more in a timed online video speed date.",seed,seek.ly,seed,N/A,"internet, psychology, video"
Self Direct,FOUND,active,Established in 2003 with offices located in Baldwinsville and Utica to provide professional home care services and home medical equipment and supplies. We provide services under the NYS DOH Traumatic Brain Injury and Nursing Home Transition and Diversion waiver programs as well as working closely with insurance companies and private pay clients.,N/A,www.selfdirectinc.com/,N/A,for profit,medical
SensArs,FOUND,active,"There are almost 5 millions of amputees, and even more nerve-injured persons, only in the USA and Europe. Together with commonly present neuropathic pain, and lost limb function (nerve injuries), they have no perception or control of the force required to hold or pick up objects and cannot feel their shape or consistency (when using prostheses). A...
Read More",seed,www.sensars.com/,grant,for profit,"medical, medical device, neuroscience"
"Sense Diagnostics, LLC",FOUND,active,"Sense Diagnostics develops and distributes medical devices for its clients.
Sense Diagnostics develops Sense, a disposable device that monitors its users’ brain activity in ICU. It features multiple environment integration, earlier diagnosis, and real-time brain activity monitoring. It uses RF sensors to detect brain activity changes.
Sense...
Read More",seed,www.senseneuro.com,seed,for profit,"health diagnostics, medical, neuroscience"
"Sense Diagnostics, LLC",FOUND,active,"Sense Diagnostics develops and distributes medical devices for its clients.
Sense Diagnostics develops Sense, a disposable device that monitors its users’ brain activity in ICU. It features multiple environment integration, earlier diagnosis, and real-time brain activity monitoring. It uses RF sensors to detect brain activity changes.
Sense...
Read More",seed,www.senseneuro.com,seed,for profit,"health diagnostics, medical, neuroscience"
Sensegon,FOUND,active,"Sensegon offers a psycho-social advertisement based-solution, derived from multi-layered human interactions in social networks.
Our technology is a cloud-based intelligence engine
which accurately profiles a user's personality through real-time human interactions which occur within any given social platform.
Users' personality is...
Read More",early stage venture,www.sensegon.com,series a,N/A,"ad targeting, advertising, psychology, social media"
SenseLabs (formerly Neurotopia),FOUND,active,"SenseLabs measures and trains the performance of the brain— to help people assert impulse control, increase focus, manage stress, handle stress, improve recovery, and improve sleep.
Providing higher performance in all of life, the company is focused on the sports, education, professional development, and wellness markets.",N/A,senselabs.com/,venture - series unknown,for profit,"hardware, health care, software, sports"
SensoMotoric Instruments (SMI),FOUND,active,"SensoMotoric Instruments (SMI) is a world leader in dedicated computer vision applications. Working closely with our clients, we have more than 20 years experience in developing and marketing application-specific gaze & eye tracking systems and OEM solutions. More than 6,000 of our eye tracker systems in operation worldwide are testimony to our...
Read More",m&a,www.smivision.com,N/A,N/A,"computer vision, image recognition, psychology, software"
Sensory Innovation Solutions,FOUND,active,seeking a $350k seed round,seed,N/A,seed,for profit,"health care, medical, neuroscience"
Sentient Medical Systems,FOUND,active,"Sentient providers of intraoperative monitoring and neurodiagnostic services, supporting over 300 health care facilities and 800 surgeons with 24/7/365 coverage.
Sentient provides Intraoperative neurophysiological monitoring of brain and/or spinal cord function during surgical procedures that pose risks of neurological damage...
Read More",m&a,www.sentientmedical.com/,N/A,for profit,"health care, hospital"
SeriousPuzzles.com,FOUND,active,N/A,m&a,www.seriouspuzzles.com,N/A,for profit,"e-commerce, internet, retail"
Serono International,NOT FOUND,N/A,N/A,N/A,N/A,N/A,N/A,N/A
Setem Technologies,FOUND,active,"Setem has developed Signal Separation technology that addresses the “Cocktail Party Problem”. Similar to the human brain, the technology provides the ability to focus on a specific speech source and mitigate or eliminate any extraneous background noise or interference. Background noise impacting voice clarity and speech perception is a major...
Read More",m&a,setemtech.com,venture - series unknown,for profit,"developer platform, enterprise software, saas"
SetPoint Medical,FOUND,active,"SetPoint Medical is dedicated to treating patients with debilitating inflammatory diseases, such as Crohn's Disease and rheumatoid arthritis, using proprietary implantable bioelectronic devices.
The scientific platform is based on the Inflammatory Reflex—the natural mechanism by which the central nervous system regulates the immune system....
Read More",late stage venture,www.setpointmedical.com,series d,for profit,"biotechnology, health care, medical device, neuroscience"
Shaadi.com,FOUND,active,"Shaadi.com is an online matchmaking site built especially for South-Asians. Besides one of most visited sites in India, it boasts more than 100 physical centers in 80 cities in India.
Shaadi.com, one of India's best known brands and the world's largest matrimonial service was founded with a simple objective - to help people find...
Read More",N/A,www.shaadi.com,venture - series unknown,for profit,"online portals, psychology, search engine, wedding"
Shanti Home,FOUND,active,N/A,N/A,www.shantihomeindia.com,N/A,N/A,"health care, psychology, rehabilitation"
SheEO,FOUND,active,"SheEO invests in women-led and majority women-owned ventures that creates social impact through new models, new mindsets, and new solutions for a better world. The activator community consists of ages from twelve to nineteen, and are women of color, LGBTQ, grandmothers, successful corporate executives, public leaders, change-makers, early stage...
Read More",N/A,www.iamasheeo.com/,N/A,for profit,"finance, psychology, women's"
Sheepdog Sciences,FOUND,closed,"Sheepdog Sciences offers learning services for individuals diagnosed with attention deficit hyperactivity.
Sheepdog Sciences was founded in 2011 by Daniel Wetmore and Alexander Butterwick and is based in California.",N/A,sheepdogsciences.com/,N/A,for profit,neuroscience
SHINE Medical Technologies,FOUND,active,"SHINE Medical Technologies, Inc. manufactures and supplies medical tracers and cancer treatment elements. The company offers Molybdenum-99, a light-emitting element that is administered to patients for the purpose of diagnosing and staging cancer and heart diseases. It also provides Iodine-131 that is used to treat thyroid cancer and various...
Read More",early stage venture,www.shinemed.com,series b,for profit,"manufacturing, medical, medical device, pharmaceutical"
Shockwave Medical,FOUND,active,"Shockwave Medical is developing the Lithoplasty™ family of balloon dilatation catheters that incorporate tiny lithotripsy electrodes designed to increase the compliance of rigid vascular and valvular lesions prior to low-pressure dilation, thereby limiting injury to healthy tissue and overcoming significant limitations of current revascularization...
Read More",ipo,shockwavemedical.com,series d,for profit,"health care, medical, medical device"
SIBIA Neurosciences,FOUND,active,N/A,N/A,N/A,N/A,N/A,"biotechnology, neuroscience"
Sibyl Vision,FOUND,active,"Sibyl Vision is the accurate, streamlined way to monitor your social media reputation -- anytime, anywhere. Their revolutionary, patent-pending sentiment-analysis algorithm, developed by Peter Kazazes, drinks from and parses the Twitter firehose, translating millions of brand-relevant tweets into easily actionable metrics that encompass...
Read More",N/A,www.sibylvision.com,N/A,N/A,"apps, psychology, software"
Sifft,FOUND,active,N/A,N/A,gosifft.com/,N/A,N/A,health care
Signal Patterns,FOUND,closed,"Signal Patterns develops psychology-based web and mobile (iPhone) applications that help people improve their well-being and relationship with others. Their products include self and relationship assessments, positive psychology activities and social tools for connecting with like-minded individuals.",seed,www.signalpatterns.com,seed,N/A,"apps, developer tools, ios, market research, mobile, music, psychology"
Simia Service Co,FOUND,active,"Simia Service is an online platform that offers e-commerce services to its clients.
The platform offers online retailing, administrative affairs, and online counselling. The online retailer sells groceries and crafted gifts to its users. The counselling platform offers psychology-based counselling to its users.
Simia Service was launched in 2011...
Read More",N/A,simiaservice.com,N/A,N/A,"consulting, legal, psychology"
Simply Psychology,FOUND,active,"Simply Psychology is a website with articles aimed at psychology students of all educational levels. The sites shares content on topics such as perspectives, behaviorism, biological psychology, cognitive, humanism, psychodynamic perspective, child development, moral development, and psychosexual stages. It also contains information on psychologists...
Read More",N/A,www.simplypsychology.org/,N/A,for profit,psychology
sixty dating,FOUND,active,An over sixty dating portal for those aged sixty years or older. It is free to join and has a searchable database with many variables. Affiliated to white label dating one of the the UK's main dating website providers.,N/A,sixtydating.com/,N/A,N/A,"e-commerce, psychology"
Skema,FOUND,active,"Promoting programming education in the early school system with the Skema-Methodology, based on research from psychology, education and technology.",N/A,www.skema.is,grant,N/A,"education, psychology, secondary education"
Skills Matter,FOUND,active,"Skills Matter is a hyper active, 9 year old startup, sustaining a community of over 35,000 passionate developers in London and some 200,000 world wide. Our mission is to help members in our community learn and share skills to write better software. We do so by staying right on top and ahead of trends. We weed through them and serve the relevant...
Read More",N/A,skillsmatter.com,venture - series unknown,N/A,"architecture, edtech, education, events, internet, software, test and measurement, training, web development"
Sleep and Fatigue Research,FOUND,active,Sleep and Fatigue Research uses a wealth of sleep research to help drivers manage fatigue and prevent accidents on the road.,N/A,safr.org.uk/,venture - series unknown,N/A,public safety
Sleep Center MD,FOUND,active,"Sleep center Maryland: Community based work of physicians and specialties at sleep center Maryland provides a multidisciplinary approach identifying the sleep disorders.
Are you facing whole time tiredness, headaches, chronic pain, decreased concentration and memory? Get in touch with sleep center and do solve sleeping Problems.
Get rid of common...
Read More",N/A,www.sleepcentermd.com/,N/A,N/A,"communities, health care, medical"
Sleep Lab of Central Jersey,FOUND,active,N/A,N/A,N/A,N/A,N/A,health care
Sleep Like Me,FOUND,active,Our product at https://www.amazon.com/dp/B01N1OKVOV,N/A,sleeplikeme.com/,N/A,for profit,"e-commerce, internet"
SleepEffect Center for Apnea Management,FOUND,active,"Dr. J.C.Goodwin, Sleep Specialist at SleepEffect Center for Apnea Management in Prescott Valley, AZ servicing the community of Yavapai County with his excellence in the field of sleep medicines. He provides treatments for sleep apnea, snoring, CPAP alternative treatments and so on. We diagnose the patients with a traditional approach as well as a...
Read More",N/A,www.sleepeffect.com,N/A,N/A,"health care, health diagnostics, medical"
Sleepio,FOUND,active,"Sleepio is an online sleep improvement programme that is clinically proven to be many times more effective than sleeping pills. Co-Founded by ex-insomnia-sufferer Peter Hames and world sleep expert Professor Colin Espie, Sleepio is now on sale in Boots pharmacies across the UK.Advisors includes Martha Lane Fox (UK Digital Champion, Co-Founder of...
Read More",seed,www.sleepio.com,seed,for profit,"health care, psychology, web browsers"
SleepIsle,FOUND,active,N/A,N/A,sleepisle.xyz,N/A,for profit,"apps, health care"
Sleeps,NOT FOUND,N/A,N/A,N/A,N/A,N/A,N/A,N/A
SleepSoft,FOUND,active,Sleep Soft LLC is a mobile software development company and has developed excellent softwares for the Android and iOS users. Some of their achievements are Sleep Machin,N/A,sleepsoftllc.com,N/A,N/A,mobile
SlidePick,FOUND,active,"How many times you have promised yourself to sit down an afternoon to organize all those photos from your vacation trip?
SlidePick is born as a solution to this false promise. We were inspired by the form and structure that our brain use to organize and distribute the constant flow of information that we receive every day. We rely on research...
Read More",N/A,www.slidepick.com,N/A,for profit,"android, ios, mobile, photography"
Smackdab,FOUND,active,Smackdab is falling in love.,N/A,www.smackdab.com,N/A,N/A,"psychology, search engine"
SmallBiz SEO Perth,FOUND,active,"We eat, sleep, breathe, drink, laugh and cry over Local Internet Marketing. We build Long-Term Relationships. We want to work with you for years and watch you and your business grow. You can always get in touch with us when you need to.
Address: 45/17 Ogilvie Rd Mount Pleasant WA 6153",N/A,www.smallbizseo.com.au/perth/,N/A,for profit,internet
SMART Brain Aging,FOUND,active,"We provide aging individuals with a truly research-supported system of brain exercise to mitigate the cognitive and functional decline of dementia through an empirically-validated system of cognitive/functional exercise, found on both a Medicare-reiumbursable Clinic and subscription-based SaaS platform.",N/A,www.smartbrainaging.com,venture - series unknown,for profit,"fitness, health care, medical"
SmartCap,FOUND,active,N/A,N/A,www.smartcaptech.com/,N/A,N/A,"hardware, health care"
SmartSalus,FOUND,active,Le vamos a ofrecer los mejores médicos y los mejores tratamientos médicos en tu ciudad a precio SMART.,N/A,www.smartsalus.com,N/A,for profit,"cosmetic surgery, health care, psychology"
Smartstones,FOUND,active,":prose translates body language into speech.
Sensory interpretation platform that translates body language signals into messaging and speech.
Our api allows us to integrate infinite sensory device types including mems (motion and location), camera vision, touch sensitive interfaces and brain wave sensors such as EEG.
First ever Think to...
Read More",N/A,www.speakprose.com/,N/A,for profit,"augmented reality, hardware, impact investing, internet of things, mobile, software"
Smile Concepts,FOUND,active,"At Smile Concepts in Pitt Street Sydney CBD we offer Implant Dentistry, Cosmetic Dentistry and all areas of General Dentistry.We look at you gums and see if they are bleeding or whether you have loose teeth, gum disease, gingivitis, bad breath. We also look at whether you are suffering from headaches due to bruxism, clenching or grinding....
Read More",N/A,www.smileconcepts.com.au,N/A,N/A,"cosmetics, dental, health care"
SNORE Australia,FOUND,active,SNORE Australia is a provider of overnight sleep studies. The company offers sleep study services focusing on respiratory and neurological disorders that occur during sleep.,m&a,www.snoreaustralia.com.au/,N/A,N/A,health care
Snowdon,FOUND,active,"Snowdon Inc. is a pharmaceutical company that is focused on three major therapeutic areas with substantial market potential: acute and chronic pain, neurological disorders, and infectious diseases. These medical conditions cause immense suffering, economic hardship, and loss of life among millions of people every day. In each of these therapeutic...
Read More",N/A,snowdonpharma.com/,venture - series unknown,for profit,"marketplace, neuroscience, pharmaceutical"
Society for Neuroscience,FOUND,active,Society For Neuroscience develop mobile applications that helps in advancing the understanding of the Brain and Nervous System. They design applications that are compatible with iPads and iPhones. Neuroscience 2012 is one of the interesting applications from SFN.,N/A,www.sfn.org,N/A,N/A,search engine
"SOFIA Labs, LLC",FOUND,active,"SOFIA's Landscape EXplorer (LEX) will be a cloud-based SaaS, providing a 24/7 personal trainer to boost one's actionable metaskills: (1) portable (not attached to a job), (2) universal (applicable to any cognitive challenge), (3) critical (economically essential - STEM, Biz, Finance etc.)
The LEX SaaS can serve individuals (B2C),...
Read More",seed,N/A,seed,for profit,"artificial intelligence, corporate training, education"
Solace Lifesciences,FOUND,active,Solace Lifesciences is a neuroscience company and innovator in solving one of the world's most problems – stress.,N/A,www.nucalm.com,debt financing,for profit,"dental, medical, neuroscience"
Solaricle,FOUND,active,"We at Solaricle share a belief of a future where we use smart and sustainable products.
According to us the way humans live determines fate of our planet, weather it is Earth, Mars or any other planet we think of living in, we would still need products and services which are designed & pursued in smart and sustainable manner.
We believe...
Read More",N/A,N/A,N/A,for profit,"analytics, artificial intelligence, communities, drones"
SOMA Analytics,FOUND,active,"SOMA Analytics' flagship product is Kelaa, a mobile phone application that measures and analyzes the effects of psychological stress and provides you with a 14 day program to improve your mental resilience. The technology combines aspects from psychology and medicine with machine learning and hardware.
Mental resilience is your ability to...
Read More",m&a,www.soma-analytics.com,venture - series unknown,N/A,"mhealth, psychology"
Somnium Lab,FOUND,active,N/A,N/A,somniumlab.net/,N/A,for profit,health care
Somnowire,FOUND,active,N/A,N/A,N/A,N/A,N/A,"health care, medical"
sones,FOUND,closed,"sones went into bankruptcy on January 1, 2012: http://www.sones.de/web/sones/home
sones developed in stealthmode a disruptive new data handling system for your Digital Universe- The Internet. It brings you back the control about what others do with your data, with a new access layer, database and filesystem. With the...
Read More",early stage venture,www.sones.com,series a,N/A,"cloud computing, enterprise software, internet, search engine, software"
Sonovum,FOUND,active,"Sonovum specializes in ultrasound brain monitoring. Currently, we are the only company worldwide to be able to non-invasively monitor minuscule changes in the cellular and molecular structure of brain tissue. With our newly developed technology, Acoustocerebrography (ACG), we can monitor these changes in acute settings as well as Permanent...
Read More",N/A,www.sonovum.de/,grant,for profit,"health diagnostics, medical device"
Sookmook Future Informatics Foundation,FOUND,active,Sookmook Future Informatics Foundation conducts AI research for firms in the IT and academia industries. It was founded by Young-min Ji.,N/A,sookmook.org,N/A,N/A,"hardware, information technology, internet of things, psychology, robotics, software"
Soothe The Psyche Therapy Inc.,FOUND,active,N/A,N/A,soothethepsyche.com,N/A,N/A,health care
Soterix Medical,FOUND,active,"Soterix Medical develops devices and accessories based on neuromodulation and brain stimulation technologies. The company was founded by Abhishek Datta and is based in New York, the United States.",N/A,soterixmedical.com/,grant,for profit,"medical, medical device, neuroscience"
Soterix Medical,FOUND,active,"Soterix Medical develops devices and accessories based on neuromodulation and brain stimulation technologies. The company was founded by Abhishek Datta and is based in New York, the United States.",N/A,soterixmedical.com/,grant,for profit,"medical, medical device, neuroscience"
South Bay Community Services - Compassion | Outreach | Wellness,FOUND,active,N/A,N/A,southbaycommunityservices.com,N/A,N/A,"communities, health care"
South Carolina National Guard,FOUND,active,N/A,N/A,scguard.com,N/A,N/A,health care
